{
  "$schema": "http://json-schema.org/draft-07/schema#",
  "title": "Resume Variant Registry",
  "description": "Config-driven map of job-title lanes to pre-authored resume files. Read by src/job_hunt/resume_registry.py; never auto-rewritten.",
  "type": "object",
  "required": ["schema_version", "default_variant", "variants"],
  "properties": {
    "schema_version": { "type": "integer", "const": 1 },
    "_comment": { "type": "string" },
    "default_variant": {
      "type": "string",
      "description": "id of the variant used when no specialized lane clears the minimum confidence."
    },
    "variants": {
      "type": "array",
      "items": {
        "type": "object",
        "required": ["id", "title_patterns", "resume_path"],
        "properties": {
          "id": { "type": "string" },
          "label": { "type": "string" },
          "title_patterns": {
            "type": "array",
            "items": { "type": "string" },
            "description": "Lowercase substrings matched against the lead title. Empty array = wildcard (default lane)."
          },
          "emphasis_skills": {
            "type": "array",
            "items": { "type": "string" }
          },
          "seniority_bands": {
            "type": "array",
            "items": { "type": "string", "enum": ["junior", "mid", "senior", "staff"] }
          },
          "resume_path": {
            "type": "string",
            "description": "Repo-relative path to the ATS-passing resume markdown for this lane."
          },
          "review_status": {
            "type": "string",
            "enum": ["missing", "draft", "draft_private", "needs_user_review", "ready_local", "ready"],
            "description": "Authoring state. Optional; absent is treated as 'draft'. 'ready' = resume is committed to the repo and must have its file present AND >=1 approved claim (profile-doctor errors otherwise). The 'private' states (draft_private, needs_user_review, ready_local) describe a resume authored locally but intentionally gitignored, so a clean checkout will not have the file; profile-doctor reports these as info, never an error."
          },
          "notes": { "type": "string" }
        }
      }
    }
  }
}
